Date,URL,Title,Text
2022-11-02,https://www.reuters.com/article/ukraine-crisis-russia-budget/ukraine-conflict-sanctions-set-to-blow-hole-in-russias-finances-idUSKBN2RS19P,"Ukraine conflict, sanctions set to blow hole in Russia's finances"," The cost of Russia's military mobilisation and the impact of Western sanctions are set to blow a hole in the government's budget forecasts and drain Moscow's reserves to their lowest level in years, according to analysts' latest calculations. That will put an ever greater strain on the Kremlin's resources as President Vladimir Putin seeks to fund a conflict with no end in sight and prepares for a possible re-election bid in 2024. After eight months of what it calls a ""special military operation"", Moscow has drawn up a 2023 budget that takes no account of the cost of the recent call-up of 300,000 reservists, the declared annexation of four Ukrainian regions - the Kremlin says the four joined Russia freely - and Western efforts to cap Russian energy export prices, analysts say. While Russia's economy initially held up relatively well to the waves of Western sanctions imposed on it, the impact is beginning to show - in analysts' assessments, if not in those of the government. ""The macroeconomic forecast, upon which the budget is based, was calculated before mobilisation,"" said Alexandra Suslina, an independent analyst. ""It does not take into account new sanctions, and therefore is not reflecting reality."" Putin's current, fourth term as a president expires in 2024 and he is yet to say if he will run again - a process that, judging by past campaigns, would likely involve courting voters with promises to spend more on wages, welfare and pensions. Kremlin spokesman Dmitry Peskov told reporters on Wednesday that Putin had not yet decided whether to run in 2024 but added: ""The social obligations of the state are an absolute priority."" Russian official forecasts estimate that GDP will fall 0.8% next year, while a Reuters poll of analysts sees the economy shrinking 2.5%. The World Bank expects a 3.6% contraction. Russia's finance ministry expects the budget deficit next year to almost double from this year to 3 trillion roubles, or 2% of gross domestic product. Analysts at state bank VTB (VTBR.MM) forecast the gap at an even wider 4-4.5 trillion roubles. Moscow sees energy revenues at 9 trillion roubles next year, or a third of its total income - a projection analysts say is also too optimistic amid upcoming sanctions on Russian energy imports by the west. ""The finance ministry forecasts incredible things such as that energy income ... would remain as before, like Russia would continue to produce the same amount of oil with demand unchanged,"" an economist at a western financial company said. As Europe cuts ties with Russia, Moscow risks losing a staggering 55% of its oil product exports, or over 80 million tonnes, next year, the government has estimated. Gazprom's gas exports already plunged 43% in January-October compared with the same period last year. The finance ministry sees non-energy revenue, or that related to economic activity, at 11.5% of GDP in 2023, around 7% higher than this year and on par with pre-pandemic levels. But analysts say that this, too, is hardly realistic. ""Consumer demand will be falling, people will be buying less, cheaper, lower in quality - and then the non-energy income forecast... will have to be revised,"" said Suslina. While Russia this week officially ended what it calls its ""partial"" mobilisation, some 300,000 reservists called up by the Kremlin for its campaign in Ukraine since September remain in military units, which also hurts economic activity. Lower economic activity and weak imports may see Moscow collecting around 1 trillion roubles less per year from value-added tax, its main non-energy income, according to a joint study by the Russian Presidential Academy Ranepa and the Gaidar Institute. Dmitry Polevoy, investment director at Moscow-based broker Locko Invest, estimates that payouts to those mobilised - including higher-than-average salaries and compensation in the event of injury or death - may come to between 900 billion roubles and 3 trillion roubles in the next half-year alone. The finance ministry did not reply to a Reuters request for a comment. Finance minister Anton Siluanov, without giving details, told Russian lawmakers last week that the budget ""allows (us) to meet all social obligations without harming macroeconomic stability."" Russia has few options for plugging the budget deficit, analysts say, as sanctions and counter-sanctions have hit foreign investors' ability to invest in domestic rouble bonds, and the finance ministry is already depleting the resources of the National Wealth Fund (NWF). As Russia has actively started spending NWF money on everything from economic support to social payments, the finance ministry sees the fund halving to 6.25 trillion roubles, or 4.2% of GDP - its lowest since 2018 - by the end of next year. ""The main budget risk amid significant sanctions pressure... is of a complete dry-out of the NWF, which could significantly undermine the federal budget's stability and the budget system as a whole,"" analysts at the Financial University said in a recent note. If it falls to 5.95 trillion roubles, or 3.7% of GDP, by the end of 2024, the amount of cash left would be the smallest Russia has had in its reserves in the last two decades, according to the budget comments by the state Audit Chamber. ""Sources to finance the budget deficit are now scarcer than ever,"" Suslina said. ""I very much hope that the finance ministry will avoid outright money printing."""
2022-11-02,https://www.reuters.com/article/ukraine-crisis-putin/dont-expect-putin-to-fall-anytime-soon-says-western-official-idUSKBN2RS1AV,"Don't expect Putin to fall anytime soon, says Western official"," President Vladimir Putin has been weakened by his decision to invade Ukraine, but a change in power at the top in Russia is unlikely any time soon due to the autocratic nature of its political system, a Western official said on Wednesday. Putin, the longest-serving paramount Kremlin leader since Josef Stalin, has dominated Russia for nearly 23 years since Boris Yeltsin gave him the nuclear briefcase on the last day of 1999. After changes to the constitution in 2020, some Russia-watchers expected Putin to rule until 2036. But the Feb. 24 invasion of Ukraine has changed perceptions. ""He has been weakened by this really catastrophic error,"" said the Western official, who spoke on condition of anonymity in order to speak freely. ""We are seeing the Russian military humbled on the battlefield by Ukraine."" The official said the war had strengthened Ukrainian statehood and prompted the further enlargement of the NATO military alliance thus weakening Putin, who turned 70 on Oct. 7. ""People can see that he has made a big error,"" said the same official. ""They (the Russians) didn't have a Plan B - they thought that this was going to be really easy."" ""That has to mean that people are talking more about succession, they are talking more about what comes next, they are imagining a life beyond. But what I am not doing is suggesting that that's any time soon."" Though there was unlikely to be a change of Kremlin leader soon, the official said that the middle of the 2020s was starting to look ""more interesting"". Russia's next scheduled presidential election is in 2024. Putin has not yet said whether he will run again or not. The Kremlin, which declined immediate comment on the Western official's comments, says Putin is by far the most popular politician in Russia and has won four presidential elections. Putin has said he has no regrets on launching what he calls Russia's ""special operation"" against Ukraine and casts the war as a watershed moment when Russia finally stood up to an arrogant Western hegemony after decades of humiliation in the years since the 1991 fall of the Soviet Union. After the West imposed the most severe sanctions in modern history on Moscow due to the war, Putin says Russia is turning towards Asia, and in particular China, after centuries of looking to the West as the crucible of economic growth and technology. The war in Ukraine has killed tens of thousands and triggered the biggest confrontation with the West since the 1962 Cuban Missile Crisis, when the Cold War superpowers came closest to nuclear war. Both Ukrainian and Russian forces are digging in for winter as temperatures start to fall, and the war is likely to continue to be ""a long, difficult and bloody conflict"", the official said. After Putin's Sept. 21 partial mobilisation order, at least 400,000 Russians have left the country in addition to the outflow of Russians who left shortly after the invasion was ordered, the official said. Russia's economy, they said, would contract by at least 4.5% in 2022 and would also contract next year, the official said. ""The GDP figures mask a really significant distortion in the economy because of the switch towards war production,"" they said. The official added that there was no sign, for now, that Russia was ready to seriously negotiate over Ukraine. ""This is going to continue to be a long, difficult, bloody conflict."""
2022-11-02,https://www.reuters.com/article/ukraine-crisis-grains-erdogan/ukraine-grain-deal-to-resume-on-wednesday-turkeys-erdogan-idUSKBN2RS0UJ,Ukraine grain deal to resume on Wednesday -Turkey's Erdogan,"Turkish President Tayyip Erdogan said that Russian participation in a U.N.-brokered Ukrainian grain export deal was to resume on Wednesday. Speaking in parliament, Erdogan said Russian Defence Minister Sergei Shoigu had informed his Turkish counterpart that the deal will resume. “After the call we held yesterday with (Russian President Vladimir) Putin, Russian Defence Minister Mr. Shoigu called our National Defence Minister Hulusi Akar and expressed that the grain transports will continue as agreed before as of 1200 (pm) today,” Erdogan said. Citing the Russian defence ministry, state news agency TASS reported shortly after Erdogan’s comments that Russia will resume its participation in the Black Sea grain deal. The export deal was agreed upon by Russia and Ukraine and brokered by Turkey and the United Nations in July to ease a world hunger crisis caused in part by Moscow’s invasion of Ukraine, a major grain producer, and an earlier blockade of its ports. It is due to expire on Nov. 19. Russia suspended its participation on Saturday, saying it was responding to a drone attack on Moscow’s fleet in Crimea that it blamed on Ukraine. Kyiv has not claimed responsibility and denies using the grain programme’s security corridor for military purposes."
2022-11-02,https://www.reuters.com/article/ukraine-crisis-russia-grain/putin-we-could-quit-grain-deal-again-but-would-not-block-grain-for-turkey-idUSKBN2RS0US,"Putin: We could quit grain deal again, but would not block grain for Turkey"," President Vladimir Putin on Wednesday reserved Russia's right to withdraw again from an international agreement allowing Ukraine to export grain via the Black Sea, after ending four days of non-cooperation with the deal. If Russia did so, however, Putin said it would not impede shipments of grain from Ukraine to Turkey. Moscow had on Saturday pulled out of the arrangement, brokered by Turkey and the United Nations, saying it could not guarantee the safety of civilian ships crossing the Black Sea because of a drone attack on its fleet there. Wednesday's U-turn followed a phone call between Putin and Turkish President Tayyip Erdogan on Tuesday and consultations between their defence ministers. In a statement, Russia's defence ministry said that, with the help of the United Nations and NATO-member Turkey, it had obtained sufficient written guarantees from Ukraine that it would not use the secure shipping corridor or its designated Ukrainian ports for strikes against Russia. Putin affirmed the receipt of those commitments, and said that if Russia withdrew once more because of Ukrainian breaches, it would substitute the entire volume of grain destined for the ""poorest countries"" for free from its own stocks. But, in a nod to Turkey's influence, as well as what he called its ""neutrality"" in Russia's conflict with Ukraine, he added: ""In any case, we will not in the future impede deliveries of grain from Ukrainian territory to the Turkish Republic."" Moscow had said on Monday it would be risky and unacceptable for ships to continue sailing through the secure corridor set up under the deal, which had freed up Ukrainian ports and shipping lanes that Russia had previously blockaded. Despite the Russian move, ships had continued to export Ukrainian grain, and a record volume moved on Monday. ""This is quite an unexpected turnaround,"" said Andrey Sizov, head of the Russia-focused Sovecon agriculture consultancy. ""We did not bury this deal, but we did not expect Russia's return to it so soon either, as it was not very clear what kind of guarantees Russia could get and how quickly it would happen. But, well, good job Erdogan."" Even after the call with the Turkish leader, the Kremlin had said Moscow would only consider resuming the agreement after a ""detailed investigation"" of a drone attack on Saturday against its Black Sea Fleet in the Crimean port of Sevastopol, which it accused Ukraine of carrying out with support from Britain. Kyiv has not claimed responsibility for the attack and denies using the humanitarian corridor for military purposes. Britain has denied involvement and accused Russia of trying to divert attention from its military failures in Ukraine. Russian political analyst Tatiana Stanovaya said Wednesday's announcement represented an acknowledgement by Putin that he could not block the shipments. ""The Kremlin itself simply fell into a trap from which it did not know how to get out,"" she said. ""It was necessary to retreat and put on a good face (not very successfully) when faced with a bad game. That is, Putin, no matter how preoccupied he is with Ukraine, his historical mission and his faith that he's right, remains a moderately rational politician who knows how to retreat if necessary."""
2022-11-02,https://www.reuters.com/article/ukraine-crisis-russia-grain-putin/putin-moscow-reserves-right-to-quit-grain-deal-but-wont-stop-grain-reaching-turkey-idUSKBN2RS1C1,"Putin: Moscow reserves right to quit grain deal, but won't stop grain reaching Turkey"," Russian President Vladimir Putin said on Wednesday that Moscow reserved the right to withdraw again from a Turkish-brokered grain shipment deal that it had returned to - but that if it did so, it would not impede grain shipments from Ukraine to Turkey. In televised remarks, Putin said that, in return for rejoining the agreement, Russia had demanded guarantees that Ukraine would not launch attacks from parts of the Black Sea covered by the deal."
2022-11-02,https://www.reuters.com/article/ukraine-crisis-grains-un/u-n-chief-welcomes-russia-return-to-ukraine-black-sea-grain-deal-idUSKBN2RS1BO,U.N. chief welcomes Russia return to Ukraine Black Sea grain deal," U.N. Secretary-General Antonio Guterres welcomed on Wednesday Russia's resumption of participation in the Ukraine Black Sea grain deal, a U.N. spokesman said, and is continuing to push for a renewal of the pact that could expire on Nov. 19. ""The Secretary-General continues his engagement with all actors towards the renewal and full implementation of the Initiative, and he also remains committed to removing the remaining obstacles to the exports of Russian food and fertilizer,"" said U.N. spokesman Stephane Dujarric."
2022-11-02,https://www.reuters.com/article/portugal-economy-golden-visa/portugal-likely-to-scrap-much-criticised-golden-visa-scheme-pm-says-idUSKBN2RS1CC,"Portugal likely to scrap much-criticised 'golden visa' scheme, PM says"," Portugal is likely to scrap its ""golden visa"" programme giving wealthy foreigners residence rights, Prime Minister Antonio Costa said on Wednesday, saying that the 10-year-old scheme had already fulfilled its role. The Authorisation of Residence for Investment Activity for people from non-EU countries, commonly known as the golden visa programme, has been heavily criticised at home for sending house prices and rents up, and the European Commission has called for the end of such national schemes. In Portugal, it has attracted 6.5 billion euros in investment by foreigners, mainly from China, Brazil and South Africa, with the bulk of the money going into real estate. Rules have changed this year to redirect investments from a red-hot property market in big cities to depopulated areas. Speaking at Lisbon's Web Summit, Europe's largest tech event, Costa said several visa schemes offered by Portugal were currently being re-evaluated and the golden visa was one of them. ""(It) probably has already fulfilled the role it had to fulfil and, at this moment, is no longer justified to keep it"", Costa told reporters. An official decision would be announced when the evaluation is completed, he said. Costa said Portugal wanted to continue to be attractive, with one example being its recent law, enacted on Monday, that created the so-called digital nomads visa. It gives foreigners with high monthly income from remote work to live and work from Portugal for a year. The European Commission has called on EU governments to end national programmes to sell citizenship to investors, which the bloc has long considered a security risk. Britain scrapped golden visas for rich investors in February amid concerns about the inflow of illicit Russian money, just before Russia's invasion of Ukraine that brought on unprecedented Western sanctions against Moscow."
2022-11-02,https://www.reuters.com/article/ukraine-crisis-russia-nuclear/russia-west-must-stop-encouraging-provocations-to-avoid-nuclear-disaster-idUSKBN2RS18O,Russia: West must stop 'encouraging provocations' to avoid nuclear disaster," Russia said on Wednesday that avoiding a nuclear clash between the world's nuclear powers was its first priority, but accused the West of ""encouraging provocations with weapons of mass destruction"". Western capitals have said Moscow is behind a ramping up of nuclear rhetoric since Russia invaded Ukraine in February - most recently by repeatedly accusing Kyiv of planning to use a radioactive ""dirty bomb"" without offering evidence. Kyiv has denied having any such plan. The Russian Foreign Ministry said it feared the five declared nuclear powers were teetering ""on the brink of a direct armed conflict"" and that the West must stop ""encouraging provocations with weapons of mass destruction, which can lead to catastrophic consequences"". ""We are strongly convinced that in the current complicated and turbulent situation, caused by irresponsible and impudent actions aimed at undermining our national security, the most immediate task is to avoid any military clash of nuclear powers,"" the ministry said in a statement. Moscow said it stood by a joint declaration issued together with the United States, China, Britain and France in January affirming their joint responsibility for avoiding a nuclear war. ""We fully reaffirm our commitment to the joint statement of the five nuclear-weapon states' leaders on the prevention of nuclear war and the avoidance of an arms race from Jan. 3, 2022,"" the ministry said. Russian President Vladimir Putin has appeared on several occasions to threaten a nuclear strike in connection with the war in Ukraine, and Moscow has repeatedly said its military doctrine permits the use of nuclear weapons if Russia's territorial integrity is under threat. In September, Putin said he was ""not bluffing"" when he stated that Russia was prepared to use ""all available means"" to defend its territory. He also said the United States had created a ""precedent"" at the end of the Second World War when it dropped two atomic bombs on Japan. Shortly afterwards, Ramzan Kadyrov, leader of the Chechnya region and a key ally of Putin's, called for Russia to use a ""low-yield nuclear weapon"" in Ukraine. Moscow also frequently accuses Kyiv of seeking to acquire nuclear weapons, and alleged at the start of the war that the Western NATO alliance planned to use Ukraine as a bridgehead to threaten Russia - allegations denied by Ukraine and NATO."
2022-11-01,https://www.reuters.com/article/usa-cyber-ransomware/russian-hackers-account-for-most-2021-ransomware-schemes-u-s-says-idUSKBN2RR3CJ,"Russian hackers account for most 2021 ransomware schemes, U.S. says"," Payment-seeking software made by Russian hackers was used in three quarters of all the ransomware schemes reported to a U.S. financial crime agency in the second half of 2021, a Treasury Department analysis released on Tuesday showed. In analysis issued in response to the increase in number and severity of ransomware attacks against critical infrastructure in the United States since late 2020, the U.S. Financial Crimes Enforcement Network (FinCEN) said it had received 1,489 ransomware-related filings worth nearly $1.2 billion in 2021, a 188% jump from the year before. Out of 793 ransomware incidents reported to FinCEN in the second half of 2021, 75% ""had a nexus to Russia, its proxies, or persons acting on its behalf,"" the report said. Washington is this week hosting a meeting with officials from 36 countries and the European Union, as well as 13 global companies to address the growing threat of ransomware and other cybercrime, including the illicit use of cryptocurrencies. ""We may approach the challenge of ransomware with a different lens - and in some cases, an entirely different set of tools - but we are all here because we know that ransomware remains a critical threat to victims across the globe and continues to be profitable for bad actors,"" Deputy Treasury Secretary Wally Adeyemo told the officials. Ransom software works by encrypting victims' data, with hackers offering the victim a key in return for cryptocurrency payments that can run as high as millions of dollars. A U.S. Treasury official on Tuesday said the department last month repelled cyberattacks by a pro-Russian hacker group, preventing disruption, an example he said of the department's stronger approach to financial system cybersecurity."
2022-11-01,https://www.reuters.com/article/ukraine-crisis-russia-tinkov/entrepreneur-tinkov-renounces-russian-citizenship-over-ukraine-war-idUSKBN2RR2N1,Entrepreneur Tinkov renounces Russian citizenship over Ukraine war," Serial entrepreneur Oleg Tinkov has renounced his Russian citizenship, saying he does not want to be associated with ""fascism"" or people who collaborate with ""killers"". In an Instagram post published on Tuesday, the 54-year-old founder of Tinkoff Bank wrote: ""I decided to renounce my Russian citizenship after Russia invasion of independent Ukraine. I am against this war, and the killing of peaceful people."" Tinkov, whose upstart digital credit card company, TCS Group Holding (TCSq.L), grew to become one of Russia's largest financial institutions, has been an outspoken critic of the invasion and President Vladimir Putin. He was forced to sell his 35% stake in TCS, Tinkoff Bank's parent, to Russian metals magnate Vladimir Potanin in April, following a string of anti-war comments. Tinkov said an original Instagram post published on Monday, with a picture of a certificate renouncing his citizenship as of Oct. 26, had ""mysteriously disappeared"". Tinkov also said on Tuesday he was suing to force the bank to stop using his name. ""My name should not be associated with fascism,"" Tinkov said. ""I hate when my brand/name is associated with the bank that collaborates with killers and blood."" The bank, for its part, said it had full legal rights to the use of the Tinkoff brand, the TASS news agency reported. The tycoon, who has likened himself to British billionaire Richard Branson and was worth almost $10 billion at his peak, launched electronics, frozen food and beer brands before setting up Tinkoff Bank in the mid-2000s. Before he sold his stake, Britain imposed sanctions on Tinkov, saying he was ""receiving benefits from the Russian government"" through his stake in a systemically important company. Tinkov is believed to live in London, where he underwent years of treatment for leukaemia. He says he now has no business interests in Russia. Tinkoff previously held U.S. citizenship, but renounced that around the time Tinkoff Bank went public in 2013 in what Washington said was an attempt to avoid tax liabilities. Tinkov reached a $500 million settlement with the Justice Department last year."
