Date,URL,Title,Text
2022-11-01,https://www.reuters.com/article/ukraine-crisis-trench-candles/ukrainian-volunteers-make-trench-candles-for-troops-from-tin-cans-idUSKBN2RR37V,Ukrainian volunteers make 'trench candles' for troops from tin cans," A group of Ukrainian volunteers has been making ""trench candles"" from tin cans for troops serving on the frontline as an energy crisis triggered by the war takes its toll on both the armed forces and civilians. Russian forces have increasingly targeted Ukraine's infrastructure including power stations and the electricity grid, causing regular blackouts and disrupting heating and water supplies. The trench candles consist of empty enamel paint cans and pet-food tins stuffed with corrugated cardboard and paraffin wax - and crucially they provide warmth as well as light. The candles have been used by troops in previous conflicts, including World War Two. ""(The candles) can be used to dry out a trench, cook food, which is very important, boil water, and warm people up,"" said Nino Nazarova, 28, an organiser of the initiative. When Nazarova secured 10,000 cans from a factory in northern Ukraine a few weeks ago, she thought it would take months to turn them all into trench candles, but volunteers completed the task during an event on Sunday at a Kyiv cultural center, singing Ukrainian folk songs as they worked. ""These cans come with a cover. So you can close them, throw them into boiling water, heat them up and then put them under your coat,"" she said. The initiative has so far delivered more than 3,000 multi-functional candles to Ukrainian trenches in the south and east of the country, Nazarova added. The candles can reportedly burn for up to five or six hours. Polina Sheremet, a co-organiser, said the more that Russian missiles rain down on Ukraine, the stronger their motivation to help the army becomes. ""The people's desire to donate and help is growing alongside the risk of missile strikes and other attacks. This is how human nature works,"" she said. Some children joined their parents during Sunday's candle-making session, including Hordii who had come with his mother to help. ""At the beginning, it (the war) was really scary, but now I have got a little bit used to it,"" he said, dsistributing strips of cardboard to the volunteers."
2022-11-01,https://www.reuters.com/article/canada-economy-immigration/canada-plans-record-immigration-targets-amid-labour-crunch-idUSKBN2RR39J,Canada plans record immigration targets amid labour crunch," Canada plans to welcome a record 500,000 new permanent residents in 2025 and has boosted its targets over the next two years as the country looks to ramp up arrivals to address an acute labour shortage, Immigration Minister Sean Fraser said on Tuesday. Canada now expects to welcome 465,000 new permanent residents in 2023, up 4% from a previous target, and 485,000 in 2024, up 7.5%. ""This year's immigration levels plan will help businesses find the workers they need,"" said Fraser in a statement. He added the new targets would also allow Canada to fulfil commitments to help those fleeing violence and war in their home countries. Canada is projected to reduce the number of government-assisted refugees it resettles by about a third, from 23,550 in 2023 to 15,250 in 2025. Prime Minister Justin Trudeau has sharply ramped up immigration since taking power in 2015. The country is on track to surpass its target of roughly 431,000 newcomers this year. Canada is struggling with an acute shortage of workers, particularly in skilled trades and industries like healthcare. The most recent job vacancy data showed there were 958,500 open roles in Canada in August and 1.0 million unemployed people. Many of the unemployed do not have the skills, or do not live in the right areas of the country, to fill those open positions. The new targets will boost the number of economic immigrants by about 13% between 2023 and 2025, with steep increases in relatively small regional programs that help funnel people to provinces and regions outside major urban centres. A record number of Canadians are now retiring, hastening a mass exodus of Canada's most highly skilled workers and leaving businesses scrambling. In a statement on Tuesday, the Business Council of Canada called for ""bolder targets"" in economic immigration. The United Nations refugee agency said in a statement it welcomed ""Canada's leadership on refugee resettlement."" Refugee lawyer Maureen Silcoff said Canada can do more to welcome vulnerable people. She contrasted Canada's policy offering refuge to Ukrainians, who are officially temporary residents under a special program and not subject to a cap, and Afghans who face danger from the Taliban for working with Canada but whose numbers are capped. ""Given what's going on in the world, given Canada's needs and given Canada's commitments, there's more that can be done."" There are many good reasons to increase immigration, said University of Waterloo economist Mikal Skuterud. But with rising interest rates, the tight labour market may slacken and newcomers may face challenges integrating, he said. ""We're at a real kind of inflection point. There is a tremendous amount of uncertainty."""
2022-11-01,https://www.reuters.com/article/western-balkans-germany/western-balkans-leaders-to-sign-deals-on-closer-integration-in-berlin-idUSKBN2RR3ID,Western Balkans leaders to sign deals on closer integration in Berlin," Western Balkans leaders are set to sign three agreements on mutual recognition of identity cards, university degrees and professional qualifications at a summit in Berlin on Thursday, German government officials said. Moves towards closer integration aim to bring greater stability to a region that emerged from the break-up of Yugoslavia and the ethnic wars of the 1990s and is still wracked by tensions. They also aim to bring Serbia, Montenegro, Bosnia-Herzegovina, North Macedonia, Kosovo and Albania closer to their stated goal of joining the neighboring European Union amid fears about the rising influence of Russia and China in the region. Serbia in particular, which was bombed by NATO two decades ago, has long struggled to balance historically close ties with Russia against aspirations for economic and political integration with the West. One of the German government officials said on Tuesday that Serbia must decide whether it wants to join the European Union or enter into a partnership with Russia. ""The need for a decision is coming to a head in view of geopolitical developments,"" the official said in reference to Russia's war in Ukraine. German Chancellor Olaf Scholz is due to receive leaders of the six Balkan countries and the EU in Berlin on Thursday as a revival of the so-called ""Berlin Process"" that his predecessor Angela Merkel put in motion."
2022-11-01,https://www.reuters.com/article/usa-treasury-cyber/u-s-treasury-thwarted-attack-by-russian-hacker-group-last-month-official-idUSKBN2RR36W,U.S. Treasury thwarted attack by Russian hacker group last month-official," The U.S. Treasury last month repelled cyber attacks by a pro-Russian hacker group, preventing disruption and confirming the effectiveness of the department's stronger approach to financial system cybersecurity, a U.S. Treasury official said on Tuesday. The Treasury has attributed the distributed denial of service (DDoS) attacks to Killnet, the Russian hacker group that claimed responsibility for disrupting the websites of several U.S. states and airports in October, said Todd Conklin, cybersecurity counselor to Deputy Treasury Secretary Wally Adeyemo. The incident, not previously reported, occurred a couple of days before similar attacks from Killnet on U.S. financial services firms, Conklin told a financial services industry and regulator conference on cybersecurity. Killnet claimed on Oct. 11 that it had attacked JPMorgan Chase & Co's network infrastructure, but the bank reported no impact on its operations. Conklin described the attack on the Treasury as ""pretty low-level DDoS activity targeting Treasury's critical infrastructure nodes."" In line with new procedures adopted under the Biden administration, he said the Treasury quickly shared internet protocol (IP) addresses used in the attack with financial services firms. ""It confirmed that we're on the right track with how we're trying to actually share tactical information with the sector in real time with the mind that we are interconnected and face the same threat actors,"" Conklin said, adding that this information includes downgraded intelligence and details on adversaries. The changes emanated from a shift in Treasury's cyber threat posture after Adeyemo and Treasury Secretary Janet Yellen took office. Adeyemo created the cybersecurity counselor position, elevating Conklin to a department-wide coordinating role. Conklin joined Treasury during former President Donald Trump's administration. Adeyemo also told the conference that the incident was a ""stark reminder"" that Treasury and financial services firms face the same threats, especially since Russia launched its war on Ukraine in February. ""Before and over the course of this unconscionable invasion, we have remained in close contact with many of you to provide critical updates, flag potential risks, and ensure we are giving you what you need to keep your systems secure,"" Adeyemo told the regulator-led Financial and Banking Information Infrastructure Committee (FBIIC) and the industry-led Financial Services Sector Coordinating Council (FSSCC). Adeyemo called for the two groups, launched 20 years ago after the 9/11 attacks, to deepen their cooperation to drive cloud and data protection workstreams and focus on new systemic risk issues."
2022-11-01,https://www.reuters.com/article/tech-websummit-ukraine/ukraines-first-lady-tech-must-be-used-to-save-people-not-to-kill-idUSKBN2RR3UR,"Ukraine's first lady: Tech must be used to save people, not to kill"," In an emotional appeal, Ukrainian first lady Olena Zelenska urged tech workers from around the world on Tuesday to create innovations to stop Russia and help save people in her war-torn country. “The dystopias we read about in science fiction novels ... are much closer than you think,” Zelenska told a packed venue at the opening event of Europe’s largest tech conference, Lisbon’s Web Summit, as she showed a video of the aftermath of a drone attack in Kyiv. “Russia puts technology at the service of terror.” Describing technology as a “battlefield” in the Russian invasion of Ukraine, Zelenska said that technological equipment such as drones and missiles were being used to “kill people,” not to save them. As some among the crowd held Ukrainian flags, Zelenska, the wife of Ukrainian President Volodymyr Zelenskiy, asked those in attendance to come up with ideas to “stop the terror, save people and restore the destroyed.” “You can help us stop the list of terrorism victims from expanding,” she said. “I believe that such technology is the future ... if it’s not, there simply won’t be a future to look forward to.” Russian forces swept into Ukraine in February in what Moscow calls a “special military operation” to eliminate dangerous nationalists and protect Russian-speakers. Kyiv calls Moscow’s military action an unprovoked imperialist land grab. The conflict has killed thousands, displaced millions and reopened Cold War-era divisions. “They (Russia) are attacking our power plants, there are blackouts everywhere in the country ... now, every day, we have no electricity, no communications and no internet for hours,” Zelenska said. She said her country was no longer able to invest in high technology in places such as schools because it must buy generators instead. More than 70,000 people are expected to attend the summit, which kicked off on Tuesday and will feature over 900 speakers ranging from Microsoft Corp’s vice chairman, Brad Smith, to Changpeng Zhao, founder of cryptocurrency exchange Binance. Web Summit’s boss, Paddy Cosgrave, told Reuters last week that 59 Ukrainian start-ups would attend the event. Mykhailo Fedorov, Ukraine’s vice prime minister who also runs the ministry of digital transformation, will also speak."
2022-11-01,https://www.reuters.com/article/usa-iran-saudi/u-s-concerned-about-iranian-threats-to-saudi-arabia-idUSKBN2RR3F5,U.S. concerned about Iranian threats to Saudi Arabia," The United States is concerned about threats from Iran against Saudi Arabia and will not hesitate to respond if necessary, a White House spokesperson said on Tuesday. ""We are concerned about the threat picture, and we remain in constant contact through military and intelligence channels with the Saudis,"" said the spokesperson from the National Security Council. ""We will not hesitate to act in the defense of our interests and partners in the region."" The official spoke after the Wall Street Journal reported that Saudi Arabia has shared intelligence with the United States warning of an imminent attack from Iran on targets in the kingdom. The Saudi government media office did not immediately respond to a Reuters' request for comment. The top commander of Iran's Revolutionary Guards, Hossein Salami, on Oct. 20 issued what he described as a warning to Saudi leaders not to rely on Israel and mentioned their ""glass palaces"". Riyadh had blessed U.S.-brokered pacts under which two of its Gulf allies forged ties with Israel in 2020 in a move that created a new regional anti-Iran axis, but also launched direct talks with Tehran last year in a bid to contain tensions amid Gulf uncertainty over U.S. commitment to the region. Saudi Arabia had blamed Iran for a 2019 missile and drone assault on its oil plants, a charge Tehran denies. The leading Sunni Muslim and Shi'ite powers have been locked in rivalry for decades, backing allies fighting proxy wars across the region. The latest concerns come at a time of strained relations between Riyadh and Washington after the Saudi-led OPEC+ alliance last month decided to cut oil output targets, which raised fears of a gasoline price spike in the United States. President Joe Biden had said there will be consequences for U.S. ties with Riyadh and several senators urged the White House to freeze all cooperation with Riyadh, including arms sales. Saudi Arabia relies heavily on the United States for its security. The United States has said Iran has supplied Russia with drones for use in its war against Ukraine, prompting Washington to set aside efforts to resurrect the Iran nuclear deal, which then-President Donald Trump abandoned in 2018."
2022-10-31,https://www.reuters.com/article/ukraine-crisis-grains-zelenskiy/ukraine-says-it-will-press-on-with-black-sea-grain-deal-idUSKBN2RQ1GX,Ukraine says it will press on with Black Sea grain deal," Ukrainian President Volodymyr Zelenskiy said on Monday that his country would continue exporting grain from its Black Sea ports under a U.N. programme despite Russia's pullout because the shipments offered stability to world food markets. He made his comments following talks with Czech Prime Minister Petr Fiala. Russia announced on Saturday that it was suspending its role in the U.N.-backed initiative that escorts cargo ships through the Black Sea. ""On our side, we are continuing with the grain initiative because we understand what we offer the world. We offer stability on the food production market,"" Zelenskiy told a joint news conference alongside Fiala. Zelenskiy said he believed Russia had left the agreement despite the fact that Moscow said it had only ""suspended"" its participation. ""This means that it was Russia that is violating the agreement,"" Zelenskiy said. ""Let's hope that our partners will be able to calm down Russia's rhetoric."" Russia said on Monday it was ""unacceptable"" for shipping to pass through a Black Sea security corridor as Ukraine was using it to ""conduct military operations against the Russian Federation"". In his comments, Zelenskiy also drew attention to a document signed with the Czech prime minister aimed at increasing cooperation to reach standards needed for Ukraine to secure membership of the North Atlantic Treaty Organisation (NATO). Ukraine's bid to gain NATO membership has been denounced as unacceptable by Russia and was one of the key reasons cited by Moscow in justifying its invasion of its neighbour."
2022-10-31,https://www.reuters.com/article/ukraine-crisis-grains-wrap/u-n-black-sea-grain-pact-under-threat-as-russia-quits-idUSKBN2RQ0Y8,U.N. Black Sea grain pact under threat as Russia quits," Grain was flowing out of Ukraine at a record pace on Monday under an initiative led by the United Nations aimed at easing global food shortages despite Russia warning it was risky to continue after it pulled out of the pact. Russia said on Monday that the deal was hardly feasible as it was impossible to guarantee the safety of shipping after its withdrawal over the weekend following what it said was a major Ukrainian drone attack on its fleet in Crimea. Other participants, however, were pressing ahead with the deal while France said it was talking to other European Union states about how to boost Ukraine grain exports via land routes. Ukraine is one of the world's largest grain exporters and the conflict with Russia led to the closure of its seaports in February, driving up food prices and contributing to a steep rise in acute hunger across the globe. The deal, signed on July 22, created a safe corridor to allow exports to resume from three Ukrainian ports and helped to ease the crisis with more than 9.5 million tonnes of corn, wheat, sunflower products, barley, rapeseed and soy exported under the pact. U.N. aid chief Martin Griffiths said on Monday the corridor does not provide cover for military action, adding there were no ships involved in a deal were transiting it on the night of Oct. 29, when Russia says its vessels in the Bay of Sevastopol in Crimea were attacked. A record volume of 354,500 tonnes of agricultural products was carried on vessels leaving Ukrainian ports on Monday as part of the Black Sea grain deal, a spokesperson for Odesa's military administration said. ""Civilian cargo ships can never be a military target or held hostage. The food must flow,"" tweeted Amir Abdullah, the U.N. official who coordinates the programme. Russia, however, cast doubts about the future of the pact. ""In conditions when Russia is talking about the impossibility of guaranteeing the safety of shipping in these areas, such a deal is hardly feasible, and it takes on a different character - much more risky, dangerous and unguaranteed,"" Kremlin spokesman Dmitry Peskov told reporters. Lloyd's of London insurer Ascot said on Monday it was pausing writing cover for new shipments using the Ukrainian grains corridor. ""From today we are pausing on quoting new shipments until we better understand the situation,"" Ascot head of cargo Chris McGill told Reuters. ""Insurance that has already been issued still stands."" Marcus Baker, global head of marine and cargo with broker Marsh, said that the change in the risk environment over the last 48 hours was ""very significant"". ""Given the change in circumstances it is not surprising that underwriters have taken the decision to suspend the facility until there is greater clarity,"" Baker said. Turkey, which helped broker the deal, remained committed to the deal which involves the inspection of cargoes at a Joint Coordination Centre in Istanbul. ""Even if Russia behaves hesitantly because it didn't receive the same benefits, we will continue decisively our efforts to serve humanity,"" President Tayyip Erdogan said in a speech. Turkish Defence Minister Hulusi Akar told his Russian counterpart Sergei Shoigu on Monday that Moscow should re-evaluate the suspension of its participation. Wheat prices rose on Monday, climbing around 5% to $8.71 a bushel in Chicago, but remained far below a peak of $13.63-1/2 set in early March shortly after the conflict began. The strong pace of wheat exports from Russia, which harvested a record crop this summer, has helped to bolster supplies on the world market. Consultancy Sovecon on Monday estimated that Russia would export 4.5 million tonnes of wheat in October, up from 2.8 million in the same month last year. Corn prices rose around 1% to $6.87-1/2 a bushel in Chicago on Monday while soybean oil rose more than 2% to 73.36 cents per lb. Traders warned that hundreds of thousands of tonnes of wheat booked for delivery to Africa and the Middle East could now be at risk. ""If I have to replace a vessel which was due to come from Ukraine, what are the options? Not much really,"" said one Singapore-based grains trader who supplies wheat to buyers in Asia and the Middle East. Ukraine is also a major exporter of corn and there were concerns that shipments to the European Union were at risk. ""As far as Europe is concerned, corn is a bigger issue than wheat as we are getting into peak season for Ukrainian corn in November,"" said one grain trader said. Analysts warned that although global agricultural commodity prices have come off record highs in recent months, local retail food prices remain high and could now face further upside. ""Typically, it takes about two months for higher grain prices to filter through the supply chain and impact consumers at the retail level,"" said a Sydney-based analyst. ""But food processors do not have much forward coverage, so it is likely to be a lot quicker."""
2022-10-31,https://www.reuters.com/article/ukraine-crisis-belarus/belarus-plans-joint-military-training-centres-with-russia-pro-lukashenko-channel-says-idUSKBN2RQ1GL,"Belarus plans joint military training centres with Russia, pro-Lukashenko channel says"," Belarus plans to create joint military training centres with Russia, a Telegram channel close to Belarusian leader Alexander Lukashenko said on Monday. The move could bolster Russia's struggling war effort in Ukraine by providing training grounds in Belarus for newly mobilised soldiers, something Western analysts have flagged as a logical step for Moscow at a time when its army is stretched and depleted. Lukashenko allowed Russian President Vladimir Putin, his close ally, to use Belarusian territory as a platform for the Feb. 24 invasion of Ukraine. But he has refrained from committing his army to fight alongside Russia's in the eight-month-old war. Lukashenko has said he expects 9,000 Russian troops to be deployed in Belarus as part of a joint military grouping he announced on Oct. 10. Neither side has disclosed how many are in Belarus now or how the joint force will be deployed. Its creation appears at least partly aimed at forcing Ukraine to beef up security near its northern border with Belarus and diverting forces from its front lines with Russia in the south and east. The ""First Pool"" Telegram channel said Lukashenko had signed a decree approving a draft agreement with Russia to establish joint training centres for military personnel, but that the agreement was subject to further negotiations."
2022-10-31,https://www.reuters.com/article/ukraine-crisis-grain-russia-defence/russia-says-movement-of-ships-in-black-sea-corridor-is-unacceptable-idUSKBN2RQ1LQ,Russia says movement of ships in Black Sea corridor is 'unacceptable'," Russia said on Monday it was ""unacceptable"" for shipping to pass through a Black Sea security corridor after it suspended its participation in a Turkish- and U.N.-brokered deal that had allowed Ukraine to resume grain exports. ""The movement of ships along the security corridor is unacceptable, since the Ukrainian leadership and the command of the Armed Forces of Ukraine use it to conduct military operations against the Russian Federation,"" the Russian defence ministry said in a statement. ""Under the current conditions, there can be no question of guaranteeing the security of any object in the indicated direction until the Ukrainian side accepts additional obligations not to use this route for military purposes."" It emphasised, however, that Russia was not withdrawing from the deal but only suspending it, in a move that Moscow announced on Saturday after what it said was a Ukrainian drone attack on its Black Sea fleet. The ministry did not say what Russia would do if ships continued to sail the route. On Monday a record volume of 354,500 tonnes of agricultural products left Ukrainian ports under the grain deal, despite Moscow's weekend announcement, a spokesperson for Odesa's military administration said. The Kremlin said earlier on Monday that without Russian security commitments, the grain deal was ""hardly feasible, and it takes on a different character - much more risky, dangerous and unguaranteed"". Ukrainian President Volodymyr Zelenskiy has accused Moscow of ""blackmailing the world with hunger"" by pulling out of the agreement."
