Date,URL,Title,Text,Novelty,Transience,Resonance,Topic
2022-10-24,https://www.cbsnews.com/news/russia-dirty-bomb-ukraine-us-reject-sergei-shoigu-warning-of-false-flag-attack/,"Kyiv, U.S. and other allies reject Russian defense chief's claim of ""dirty bomb"" provocation from Ukraine","Ukraine and several of its allies, including the United States, have rejected a claim from Russia's defense minister, who said that Ukraine was preparing to detonate a ""dirty bomb"" in its own territory. Russian Defense Minister Sergei Shoigu made the claims in a series of calls with U.S., British, French and Turkish defense officials. ""We reject reports of Minister Shoigu's transparently false allegations that Ukraine is preparing to use a dirty bomb on its own territory. The world would see through any attempt to use this allegation as a pretext for escalation,"" said U.S. National Security Coucil spokesperson Adrienne Watson. A ""dirty bomb"" uses conventional explosives to spew radiological materials into the air and contaminate the surrounding area. The size of the area contaminated would depend on the size of the explosion.Russian authorities repeatedly have made allegations that Ukraine could detonate a dirty bomb in a false flag attack and blame it on Moscow. Ukrainian authorities, in turn, have accused the Kremlin of hatching such a plan. British Defense Secretary Ben Wallace strongly rejected Shoigu's claim and warned Moscow against using it as a pretext for escalation. The British Ministry of Defense noted that Shoigu, in a call with Wallace, ""alleged that Ukraine was planning actions facilitated by Western countries, including the U.K., to escalate the conflict in Ukraine."" ""The Defense Secretary refuted these claims and cautioned that such allegations should not be used as a pretext for greater escalation,"" the ministry said. In a televised address Sunday evening, Ukrainian President Volodymyr Zelenskyy suggested that Moscow itself was setting the stage for deploying a radioactive device on Ukrainian soil. ""If Russia calls and says that Ukraine is allegedly preparing something, it means only one thing: that Russia has already prepared all of it,"" Zelenskyy said. The mention of the dirty bomb threat in Shoigu's calls seemed to indicate the threat of such an attack has risen to an unprecedented level. The French Ministry of the Armed Forces said Shoigu told his counterpart, Sebastien Lecornu, that the situation in Ukraine was rapidly worsening and ""trending towards uncontrollable escalation."" ""It appears that there is a shared feeling that the tensions have approached the level that could raise the real threat for all,"" said Fyodor Lukyanov, the Kremlin-connected head of the Council for Foreign and Defense policies, a Moscow-based group of top foreign affairs experts. The rising tensions come as Russian authorities reported building defensive positions in occupied areas of Ukraine and border regions of Russia, reflecting fears that Ukrainian forces may attack along new sections of the 620-mile front line of the war, which enters its ninth month on Monday. In recent weeks, Ukraine has focused its counteroffensive mostly on the Kherson region. Their relentless artillery strikes cut the main crossings across the Dnieper River, which bisects the southern region, leaving Russian troops on the west bank short of supplies and vulnerable to encirclement. Kirill Stremousov, the deputy head of the Russian-installed regional administration in Kherson, said Sunday in a radio interview that Russian defensive lines ""have been reinforced and the situation has remained stable"" since local officials strongly encouraged all residents of the region's capital and nearby areas Saturday to evacuate by ferry to the river's east bank. The region is one of four that Russian President Vladimir Putin illegally annexed last month and put under Russian martial law on Thursday. Kherson city has been in Russian hands since the early days of the war, but Ukraine's forces have made advances toward reclaiming it. About 20,000 Kherson residents have moved to places on the east bank of the Dnieper River, the Kremlin-backed regional administration reported. The Ukrainian military said Sunday that Russia's military also withdrew its officers from areas on the west bank, leaving newly mobilized, inexperienced forces. The Ukrainian claim could not be independently verified. As Ukraine presses south after liberating the Kharkiv region in the north last month, authorities in the western Russian provinces bordering northeastern Ukraine appeared jittery. The governor of Russia's Kursk region, Roman Starovoit, said Sunday that two defensive lines have been built and a third one would be finished by Nov. 5. Defensive lines were also established in the Belgorod region, Gov. Vyacheslav Gladkov said. More defensive positions were being built in the Luhansk region of eastern Ukraine, said Yevgeny Prigozhin, a millionaire Russian businessman who owns the Wagner Group, a mercenary military company that has played a prominent role in the war. Prigozhin said his company was constructing a ""Wagner line"" in the Luhansk region, another of the Ukrainian provinces Putin illegally annexed last month. Prigozhin posted images last week showing a section of newly built defenses and trench systems southeast of the town of Kreminna. The British Defense Ministry said Sunday ""the project suggests Russia is making a significant effort to prepare defenses in depth behind the current front line, likely to deter any rapid Ukrainian counteroffensives."" Russia's forces captured Luhansk several months ago. Pro-Moscow separatists declared independent republics in the region and neighboring Donetsk eight years ago, and Putin made controlling all of both provinces a goal at the war's outset. The Institute for the Study of War, a think tank in Washington, said Sunday that Russia's latest strategy of targeting power plants appeared aimed at diminishing Ukrainians' will to fight and forcing the government in Kyiv to devote more resources to protecting civilians and energy infrastructure. It said the effort was unlikely to damage Ukrainian morale but would have significant economic impacts. President Zelenskyy said Sunday that utilities workers were well on their way to restoring electricity supplies cut off by large-scale Russian missile strikes Saturday, but acknowledged that it would take longer to provide heating. Nine regions across Ukraine, from Odesa in the southwest to Kharkiv in the northeast, saw more attacks targeting energy and other critical infrastructure over the past day, the Ukrainian army's general staff said. It reported a total of 25 Russian airstrikes and more than 100 missile and artillery strikes around Ukraine. In response, Zelenskyy appealed to mayors and other local leaders to ensure that Ukrainians heed official calls to conserve energy. ""Now is definitely not the time for bright storefronts and signs,"" he said.",1.816287916008049,2.3653164031879794,-0.5490284871799305,3
2022-10-24,https://www.cbsnews.com/colorado/news/lions-ukraine-travel-colorado-wild-animal-sanctuary-refuge/,Lions who used to be at zoo in Ukraine travel all the way to Colorado,"Last Thursday was a lazy day for seven lions at The Wild Animal Refuge in southeastern Colorado. ""They're not acting 100% themselves right now,"" said refuge spokesman Taylor Logan. The animals had to be sedated to get some medical work done before a CBS News Colorado crew visited the Las Animas County facility this week. The Wild Animal Refuge isn't open to the public. It's a secondary space belonging to Weld County's popular The Wild Animal Sanctuary. The lions had quite the journey to get there. ""They flew from Romania to Dallas and got driven up,"" said Logan. Before all that, they were the pride of the zoo in Odessa, Ukraine. ""They're essentially like house cats if you break it down. Just bigger claws, bigger teeth. Everything's kind of escalated but they are very playful with each other. They like to wrestle just like your housecats will,"" said Logan. That life for the lions came to an end when Russia invaded Ukraine. They had to be evacuated to Romania to save them from the bombing. They stayed there while zookeepers tried to find them a new home. That's when Colorado's The Wild Animal Sanctuary got involved. ""When it seemed like it might be a longer-term thing and they were having trouble finding places, they gave us a call,"" said Logan. The lions went from a zoo habitat to living out their days in a brand new 80-acre enclosure where they are free to roam or just relax. It's quite the upgrade and adjustment for them. ""This is all a brand-new process,"" said Logan. ""It was a long trip for them, so they were a little on edge, a little hungry. Just wanted to get out of their smaller cages and we got them in here but within a day or two just giving them some space and giving them some fresh water, they started to calm down."" Despite everything, though, it's a far better fate than anyone could have imagined for them when the bombing began. ""They're very comfortable. Their personalities are out, and they all love to play,"" said Logan. The Wild Animal Sanctuary got 9 lions in total. Seven of them are down at the facility in Las Animas County but two are at their facility in Keenesburg.",4.359905896645141,3.5663558088193796,0.7935500878257611,0
2022-10-23,https://www.cbsnews.com/news/bucha-ukraine-60-minutes-viewer-reaction-2022-10-23/,"Viewers react to 60 Minutes' report on Bucha, Ukraine","In the mail this week, as Russia stepped up its drone attacks on civilian targets in Ukraine, viewers commented on Scott Pelley's story last Sunday on ""The Lost Souls of Bucha,"" and the attempt to restore names and faces to civilians hastily buried in a mass grave in the Kyiv suburb. ""Thank you for honoring the dead of Bucha and reaching our hearts and consciences,"" Lisa Rowen from Baltimore, Maryland, wrote. ""You will get some complaints about the graphic nature of your report on Bucha, but it was brilliantly done and important for everyone to see and understand,"" Jonathan House, COL (Ret) USA, from Fort Worth, Texas, said. And there was this from a Canadian viewer. ""So utterly heartbreaking, shocking, terrifying and horrifying, producing tears and anger that I've no doubt are the collective reactions of those who watched this,"" Meghan Hill from Sechelt, British Columbia, told us.",4.010414782697519,2.9529972262767563,1.0574175564207628,6
2022-10-22,https://www.cbsnews.com/seattle/news/russia-missile-attack-ukraine-power-outages-kyiv/,"Russia unleashes barrage of missiles in Ukraine in ""massive"" attack","Russia unleashed a barrage of missiles overnight — ""a massive missile attack"" that targeted ""critical infrastructure,"" Ukraine's air force said in a statement Saturday. Ukrainian officials confirmed at least half a dozen regions were targeted, including the capital city, Kyiv. The air force said it downed 18 out of 33 cruise missiles launched from air and sea. ""Several rockets"" targeting the capital were shot down on Saturday morning, Kyiv Mayor Vitali Klitschko said on the Telegram messaging service. Similar reports were made by the governors of six western and central provinces, as well as the southern Odesa region on the Black Sea. The attack is part of Russia's latest strategy. Over the past two weeks, Moscow has increased its attacks on key civilian infrastructure across Ukraine, as the country braces for a cold winter. About 40% of the country's electric power system has been severely damaged, officials said. President Volodymyr Zelenskyy said earlier in the week that 30% of Ukraine's power stations have been destroyed since Oct. 10. On Saturday, hundreds of thousands of people in central and western Ukraine woke up to power outages. The western city of Khmelnytskyi, which straddles the Bug river and was home to some 275,000 people before the war, was left with no electricity Saturday, shortly after local media reported several loud explosions. The city council urged local residents to store water, ""in case it's also gone within an hour,"" in a social media post on Saturday. The mayor of Lutsk, a city of 215,000 in Ukraine's far west, made a similar appeal on Telegram on Saturday. Power in Lutsk had been partially knocked out after Russian missiles slammed into local energy facilities, he said. The central city of Uman, a key pilgrimage center for Hasidic Jews which counted some 100,000 residents before the war, was also plunged into darkness after a rocket hit a nearby power station, regional authorities said on Telegram. In the capital and four surrounding regions, including Cherkasy, rolling blackouts came into effect on Saturday morning in response to the reduced power supplies. The state energy company Ukrenergo continued to urge all Ukrainians to conserve energy. Earlier this week, Zelenskyy called on consumers to curb their power use between 7 a.m. and 11 a.m. daily, and avoid using energy-guzzling appliances such as electric heaters.",2.9028036489651172,2.1424928192322024,0.7603108297329149,5
2022-10-21,https://www.cbsnews.com/seattle/news/ukraine-news-russia-us-army-101st-airborne-nato-war-games-romania/,The U.S. Army's 101st Airborne is practicing for war with Russia just miles from Ukraine's border,"Mihail Kogălniceanu, Romania — The U.S. Army's 101st Airborne Division has been deployed to Europe for the first time in almost 80 years amid soaring tension between Russia and the American-led NATO military alliance. The light infantry unit, nicknamed the ""Screaming Eagles,"" is trained to deploy on any battlefield in the world within hours, ready to fight. CBS News joined the division's Deputy Commander, Brigadier General John Lubas, and Colonel Edwin Matthaidess, Commander of the 2nd Brigade Combat Team, on a Black Hawk helicopter for the hour-long ride to the very edge of NATO territory — only around three miles from Romania's border with Ukraine. From the moment Russian President Vladimir Putin launched his full-scale invasion of Ukraine on February 24, his forces have advanced northward from the Crimean Peninsula, a Ukrainian region that Moscow illegally seized control of in 2014. For more than seven months, Russian troops have tried to push along the Black Sea coast into the Kherson region, aiming to capture the key Ukrainian port cities of Mykolaiv and Odesa. Their goal is to cut off all Ukrainian access to the sea, leaving the country and its military forces landlocked. That threat, so close to NATO territory in Romania, is why one of America's most elite air assault divisions has been sent in, with some heavy equipment. ""We're ready to defend every inch of NATO soil,"" Lubas told CBS News. ""We bring a unique capability, from our air assault capability… We're a light infantry force, but again, we bring that mobility with us, for our aircraft and air assaults."" Skirting northward along Romania's Black Sea coast, the Black Hawk eventually touched down at a forward operating site where U.S. and Romanian troops were pounding targets during a joint ground and air assault exercise. The tank rounds and artillery fire were real. The drill was meant to recreate the battles Ukraine's forces are fighting every day against Russian troops, just across the border. The war games so close to that border are a clear message to Russia and to America's NATO allies, that the U.S. Army is here. ""The real meaning for me, to have the American troops here, is like if you were to have allies in Normandy before any enemy was there,"" Romanian Major General Lulian Berdila told CBS News, referring to the landmark World War II battle on France's north coast. The American forces have been establishing a garrison at the Romanian military's air base. In all, about 4,700 soldiers from the 101st Airborne's home base in Fort Campbell, Kentucky, have been deployed to reinforce NATO's eastern flank. Matthaidess told CBS News that he and his troops were the closest American forces to the fighting in Ukraine. From their vantage point, they've been ""closely watching"" the Russian forces, ""building objectives to practice against"" and conducting drills that ""replicate exactly what's going on"" in the war. ""It keeps us on our toes,"" he said. The ""Screaming Eagles"" commanders told CBS News repeatedly that they are always ""ready to fight tonight,"" and while they're there to defend NATO territory, if the fighting escalates or there's any attack on NATO, they're fully prepared to cross the border into Ukraine.",2.2641629138961648,1.776385834631134,0.48777707926503067,0
2022-10-21,https://www.cbsnews.com/minnesota/news/ukraine-kurt-groszhans-north-dakota-farmer-detained-home/,North Dakota farmer detained in Ukraine for nearly a year returns home,"A North Dakota farmer who had been detained in Ukraine since November 2021 — on accusations that he planned to kill his business partner — is back home, the state's two U.S. senators announced Friday. In a statement to CBS affiliate KX News, Republican Sen. Kevin Cramer said the events that led to Kurt Groszhans' return were ""sensitive."" ""He has asked everyone to respect his privacy at this time,"" Cramer said. ""I intend to do that."" Cramer and the state's other Republican senator, John Hoeven, said they are grateful for Groszhans' safe return home. Groszhans, from Ashley, North Dakota, has ancestors from Ukraine and went there to farm in 2017. The relationship with his partner, law professor Roman Leshchenko, crumbled after Groszhans alleged that Leshchenko embezzled money from him. Groszhans and his assistant were arrested on charges of plotting to assassinate Leshchenko, who was then Ukraine's agriculture minister. Groszhans said in a statement Friday that the Ukrainian officials made up the charges in an ""effort to shut me up"" after he discovered corruption ""at the highest levels"" of the government. ""I am grateful to be home after this horrible ordeal,"" Groszhans said. ""My family and supporters worked tirelessly over a long period of time to make this happen, and it was nice to be able to celebrate my birthday on North Dakota soil. ""The fact they refused to classify me as a wrongful detainee was an unfortunate and politically cowardly act that cost me almost a year of my life,"" he said. Groszhans was among a handful of Americans jailed in Ukraine or Russia whose departures have been complicated by the war.",3.668738082602965,3.357450528861464,0.3112875537415012,6
