Date,URL,Title,Text,Novelty,Transience,Resonance,Topic
2022-10-10,https://www.cbsnews.com/sanfrancisco/news/ukraine-news-russia-war-kyiv-missile-attack-putin-crimea-bridge-sf/,Russia rains missiles down on Ukraine's capital and other cities in retaliation for Crimea bridge blast,"President Volodymyr Zelenskyy said Monday people were killed and injured in multiple missile strikes on cities across Ukraine, including the first bombardment of the capital in months. CBS News senior foreign correspondent Charlie D'Agata said the strikes, which could signal a major escalation in the eight-month-old war, appeared to be entirely punitive — retaliation meant to terrorize Ukrainian civilians in densely-populated urban neighborhoods, close to government buildings, with one even hitting a children's playground. Ukraine's national police later said at least 10 people were killed and about 60 others injured by the missile strikes early Monday morning. Russia's strongman leader Vladimir Putin acknowledged the barrage of missiles, which Russia claimed targeted only energy infrastructure, was retaliation for an apparent Ukrainian attack on a key bridge over the weekend. Putin warned Monday that if Ukraine continued to mount ""terrorist attacks"" on Russia, his regime's response would be ""tough and proportionate to the level of threats."" ""Unfortunately there are dead and wounded. Please do not leave the shelters,"" Zelenskyy told Ukraine's citizens on social media earlier Monday, accusing Russia of wanting to ""wipe us from the face of the Earth."" The explosions in Kyiv and other cities came just a day after Putin blamed Kyiv for a massive explosion on a 12-mile bridge connecting Crimea with Russia. Crimea is a large Ukrainian peninsula that Russia occupied and then unilaterally annexed eight years ago during a previous invasion. The annexation of that territory, like Putin's recent land grab of four Ukrainian regions that he declared Russian soil last week, have been condemned as illegitimate and illegal by Ukraine, the United Nations, the U.S. and other Ukrainian partners. ""Ukraine is under missile attack. There is information about strikes in many cities of our country,"" Kyrylo Tymoshenko, deputy head of the Ukrainian president's office, said on social media. General Valeriy Zaluzhnyi, Commander-in-Chief of the Ukrainian Armed Forces, said on Twitter that Russia had launched 75 missiles at Ukraine but that ""41 of them were neutralized by our air defence."" Zelenskyy later emerged onto a street in Kyiv to record a selfie video with a message to his people and the world, denouncing Russia for the barrage of missiles which he said had targeted Ukraine's energy infrastructure, and its civilians. ""They have specifically chosen such a time and such targets to cause as much damage as possible,"" the president said. ""But we Ukrainians, we help each other, believe in ourselves, rebuild everything. Now the shortages of electricity may occur, but not the shortage of our defiance and our confidence in our victory."" In Kyiv, reporters for the French news agency AFP heard at least five explosions in two salvos Monday morning, and a BBC News reporter ducked for cover as a massive explosion struck while he was on the air. Some of the missiles hit the center of the capital. Previous attacks largely targeted Kyiv's outskirts. Videos posted on social media showed black smoke rising above several areas of the city. Russia's last strike on the capital was on June 26. Other major cities hit by explosions Monday included Lviv, in Ukraine's far west, which has been a refuge for many people fleeing the fighting in the east. The foreign minister of Moldova, a small nation that sits along Ukraine's southwest border, said three cruise missiles ""from Russian ships in the Black Sea"" had flown through Moldova's airspace as they headed for Ukraine on Monday morning. Foreign Minister Nicu Popescu added in his Twitter message that he had ""instructed that Russia's ambassador be summoned to provide an explanation."" As the European Union condemned Russia's attack and said the targeting of civilians amounted to ""a war crime,"" Russia's Defense Ministry confirmed the ""massive strike with long-range precision weapons."" It claimed the missiles had targeted ""objects of the military command and control, communications and energy systems of Ukraine"" and that ""all assigned objects were hit."" Witnesses also reported a loud explosion Monday morning in Russia's Belgorod region, meanwhile, which sits right along Ukraine's eastern border. One witness told Reuters there was a loud bang and windows shook. The cause of the blast wasn't clear. The explosions came a day after Putin said Ukraine was behind an explosion on the Kerch bridge, linking Crimea with Russia, that left three people dead. ""The authors, perpetrators and sponsors are the Ukrainian secret services,"" Putin said of Saturday's bridge bombing, which he described as a ""terrorist act."" Putin spoke during a meeting with the head of the investigation committee he has set up to look into the bombing, Russian news agencies reported. The Russian leader was gearing up for a meeting with his Security Council later Monday, the Kremlin told local news agencies. ""Tomorrow the president has a planned meeting with the permanent members of the Security Council,"" Kremlin spokesman Dmitry Peskov said. The blast that hit the bridge sparked celebrations among Ukrainians and others on social media. But Zelenskyy, in his nightly address on Saturday, didn't directly mention the incident, and officials in Kyiv have made no direct claim of responsibility. On Saturday, Russia said some road and rail traffic had resumed over the strategic link, a powerful symbol of the Kremlin's 2014 annexation of Crimea. The bridge has served as a vital supply link between Russia and the annexed Crimean peninsula during its current invasion of south and eastern Ukraine. Some military analysts argue the explosion could have a major impact if Moscow sees the need to shift already hard-pressed troops to Crimea from other regions — or if it prompts a rush by residents to leave. Mick Ryan, a retired Australian senior officer now with the Center for Strategic and International Studies in Washington, said even if Kyiv wasn't behind the blast, it constituted ""a massive influence operation win for Ukraine. ""It is a demonstration to Russians, and the rest of the world, that Russia's military cannot protect any of the provinces it recently annexed,"" he said on Twitter. Zelenskyy, meanwhile, denounced a Russian missile strike on Sunday that killed at least 17 people in Zaporizhzhia, the latest deadly bombardment of the southern Ukrainian city. The attack also wounded 89 people, according to a statement from the president's office. Zelenskyy described the ""merciless strikes on peaceful people"" and residential buildings as ""absolute evil"" perpetrated by ""savages and terrorists."" Regional official Oleksandr Starukh posted pictures of heavily damaged apartment blocks on social media and said a rescue operation had been launched to find victims under the rubble. Russian officials, meanwhile, denounced on Sunday what they said was a surge in Ukrainian fire into its territory that had hit homes, administrative buildings and a monastery. Russia's FBS, which is responsible for border security, said on Sunday: ""Since the start of October, the number of attacks from Ukrainian armed formations on Russia's border territory has considerably increased."" More than 100 artillery attacks, concentrated on the western border regions of Belgorod, Bryansk and Kursk, had hit housing and administrative buildings, said the statement. The attacks had killed one person and wounded five others.",1.327696752539995,2.4625627720646435,-1.1348660195246485,9
2022-10-08,https://www.cbsnews.com/atlanta/news/crimea-bridge-russia-war-in-ukraine-damaged-key-supply-route-putin-birthday/,"Blast damages Crimea bridge, key supply route in Russia's war in Ukraine","An explosion caused the partial collapse of a bridge linking the Crimean Peninsula with Russia on Saturday, damaging a key supply artery for the Kremlin's faltering war effort in southern Ukraine. Russian authorities said a truck bomb caused the blast and that three people were killed. Images on social media Saturday showed the Kerch Bridge, which has train and automobile sections, in flames. The railway bridge was ablaze and a section of the parallel road bridge collapsed into the sea. The bombing came a day after Russian President Vladimir Putin turned 70, dealing him a humiliating blow that could lead him to up the ante in his war on Ukraine. One military analyst called it a punch in the face for Putin on his birthday, CBS News' Charlie D'Agata reports. Russian President Vladimir Putin signed a decree late Saturday tightening security for the Kerch Bridge and for energy infrastructure between Crimea and Russia. Russia's federal security service, the FSB, was put in charge of the effort, according to a Kremlin statement. The speaker of the Russian-backed regional parliament in Crimea accused Ukraine of the bombing, but Moscow didn't apportion blame. Ukrainian officials have repeatedly threatened to strike the bridge, and some lauded the destruction on Saturday. But Kyiv stopped short of claiming responsibility. Ukrainian President Volodymyr Zelenskyy, in a video address, indirectly acknowledged the attack on the bridge by talking about the weather in Crimea but did not address its cause. ""Today was a good and mostly sunny day on the territory of our state,"" he said. ""Unfortunately, it was cloudy in Crimea."" He said Ukraine wants a future ""without occupiers. Throughout our territory, in particular in Crimea."" The speaker of Crimea's Kremlin-backed regional parliament immediately accused Ukraine, though the Kremlin didn't apportion blame. Ukrainian officials have repeatedly threatened to strike the bridge and some lauded the attack, but Kyiv stopped short of claiming responsibility. The explosion risked a sharp escalation in Russia's eight-month war, with some Russian lawmakers calling for Putin to declare a ""counterterrorism operation"" in retaliation, shedding the term ""special military operation"" that had downplayed the scope of fighting to ordinary Russians. Such a move could be used by the Kremlin to further broaden the powers of security agencies, ban rallies, tighten censorship, introduce restrictions on travel and expand a partial military mobilization that Putin ordered last month. Hours after the explosion, Russia's Defense Ministry announced that the air force chief, Gen. Sergei Surovikin, would be named commander of all Russian troops fighting in Ukraine. It was the first official appointment of a single commander for all Russian forces in Ukraine. Surovikin had led Russian forces in Syria and was accused of overseeing a brutal bombardment that destroyed much of the city of Aleppo. The Kerch Bridge opened in 2018 and is a tangible symbol of Moscow's claims on Crimea. It has provided an essential link to the Crimean Peninsula, which Russia annexed from Ukraine in 2014. The $3.6 billion bridge, the longest in Europe, is vital to sustaining Russia's military operations in southern Ukraine. Putin himself presided over the bridge's opening in 2018. The attack on it ""will have a further sapping effort on Russian morale, (and) will give an extra boost to Ukraine's,"" said James Nixey of Chatham House, a think tank in London. ""Conceivably the Russians can rebuild it, but they can't defend it while losing a war."" Russia's National Anti-Terrorism Committee said the truck bomb caused seven railway cars carrying fuel to catch fire, resulting in a ""partial collapse of two sections of the bridge."" A man and a woman riding in a vehicle across the bridge were killed by the explosion, Russia's Investigative Committee said. It didn't provide details on the third victim or what happened to the truck driver. The blast occurred even though all vehicles crossing the bridge undergo checks for explosives by state-of-the-art control systems, drawing a stream of critical comments from Russian war bloggers who urged Moscow to retaliate by striking Ukrainian civilian infrastructure. The truck that exploded was owned by a resident of the Krasnodar region in southern Russia. Russia's Investigative Committee said investigators searched the man's home and were looking at the truck's route. Train and automobile traffic over the bridge was temporarily suspended. Automobile traffic resumed Saturday afternoon on one of the two links that remained intact from the blast, with the flow alternating in each direction and vehicles undergoing a ""full inspection procedure,"" Crimea's Russia-backed regional leader, Sergey Aksyonov, wrote on Telegram. Rail traffic was resuming slowly. Two passenger trains departed from the Crimean cities of Sevastopol and Simferopol and headed toward the bridge Saturday evening. Passenger ferry links between Crimea and the Russian mainland were being relaunched Sunday. The Russian Defense Ministry said troops in the south were receiving necessary supplies through the land corridor along the Sea of Azov and by sea. Russia's Energy Ministry said Crimea has enough fuel for 15 days. Putin was informed about the explosion and he ordered the creation of a government panel to deal with the emergency. Gennady Zyuganov, head of the Russian Communist Party, said the ""terror attack"" should serve as a wake-up call. ""The special operation must be turned into a counterterrorist operation,"" he declared. Leonid Slutsky, head of the foreign affairs committee in the Russian parliament's lower house, said ""consequences will be imminent"" if Ukraine was responsible. And Sergei Mironov, leader of the Just Russia faction, said Russia should respond by attacking key Ukrainian infrastructure, including power plants, bridges and railways. Such statements may herald a decision by Putin to declare a counterterrorism operation. The parliamentary leader of Ukrainian President Volodymyr Zelenskyy's party stopped short of claiming that Kyiv was responsible, but cast the bridge explosion as a consequence of Moscow's takeover of Crimea. ""Russian illegal construction is starting to fall apart and catch fire. The reason is simple: If you build something explosive, then sooner or later it will explode,"" said David Arakhamia of the Servant of the People party. The Ukrainian postal service announced it would issue stamps commemorating the blast, as it did after the sinking of the Moskva, a Russian flagship cruiser, by a Ukrainian strike. The secretary of Ukraine's National Security and Defense Council, Oleksiy Danilov, tweeted a video with the Kerch Bridge on fire and Marilyn Monroe singing her ""Happy Birthday Mr. President"" song. In Moscow, Foreign Ministry spokeswoman Maria Zakharova said ""the reaction of the Kyiv regime to the destruction of civilian infrastructure shows its terrorist nature."" Local authorities in Crimea made conflicting statements about what the damaged bridge would mean for residents. The peninsula is a popular destination for Russian tourists and home to a Russian naval base. A Russian tourist association estimated that 50,000 tourists were in Crimea on vacation on Saturday. Moscow, meanwhile, continues to suffer battlefield losses. On Saturday, a Kremlin-backed official in Ukraine's Kherson region announced a partial evacuation of civilians from the southern province, one of four illegally annexed by Moscow last week. Kirill Stremousov told Russia's state-run RIA Novosti agency that young children and the elderly could be relocated because Kherson was getting ""ready for a difficult period.""",1.203118313342559,2.5158688007380756,-1.3127504873955167,3
2022-10-07,https://www.cbsnews.com/colorado/news/ukraine-news-russia-nuclear-strike-fear-putin-bombs-zaporizhzhia-civilians/,Inside a Ukraine city where civilians are being punished by Russian bombs for Putin's military losses,"Zaporizhzhia, Ukraine — We've been to the front lines, and to cities recently liberated from Russian occupation amid Ukraine's lightning counteroffensive. But you don't have to go that far to see the destruction Russia is capable of. We visited the city of Zaporizhzhia, miles from any front-line combat, not long after it was hit with a barrage of Russian rockets on Thursday. The explosions sent emergency teams scrambling in a desperate search for those who survived the strike. At times, they found only those who had not. We arrived to find firefighters dousing a mountain of twisted metal and debris. War crimes investigators were already looking through the rubble. Residents stood nearby, staring in disbelief. Just a few hours after the rocket attack, it was no longer a rescue mission. The building in the middle of a main street in an upmarket part of Zaporizhzhia, several miles from any front line and at least 25 miles from Russian-held territory, was still smoldering. The city of Zaporizhzhia has remained firmly under Ukrainian control, but it's the regional capital of one of the four areas Russian President Vladimir Putin illegally annexed just a few days ago. Resident Olena got a phone call from her 70-year-old mother at 5 a.m. on Thursday, saying she was trapped beneath the rubble. ""She has broken ribs, a lung contusion and broken leg,"" Olena told CBS News. ""But she is alive."" Despite the ordeal, Olena seemed remarkably composed. Her real emotions, however, were simmering just underneath the calm veneer. ""I'm very angry, very angry,"" she told us. ""We need help,"" she said, begging the wider world to ""stop this."" Lying on the pavement outside were body bags containing three of 11 people known to have been killed by the Russian strike. With the search still going on Friday, it was possible more innocent victims of Putin's senseless war were yet to be found. It was the second major missile attack on civilians in Zaporizhzhia in just a week. Last Friday we saw the aftermath of a strike on a civilian convoy that killed at least 30 people. Ukrainian troops continue to smash through front lines in the south and the east, forcing the Russian invaders to retreat. Battlefield commanders tell us Russian forces are in ""complete disarray."" One of the factors behind the recent success, according to a British intelligence report released on Friday, is the vast number of Russian tanks the Ukrainians have captured. The report estimates that at least 440 have been seized — amounting to roughly half of Ukraine's current tank fleet. Infuriated by the losses, Putin has retaliated by launching long-range weapons into residential areas far from the fighting, spreading terror. What Russia cannot capture, it seeks to destroy. The fear, voiced bluntly on Thursday by President Biden, is that the Russian leader will feel so backed into a corner that he'll resort to even more lethal tactics in that strategy, including his nuclear arsenal.",0.9386575380885587,2.959213835015259,-2.0205562969267,2
2022-10-06,https://www.cbsnews.com/pittsburgh/news/marc-fogel-being-moved-to-hard-labor-colony-in-russua/,"Marc Fogel, jailed in Russia, being moved to hard-labor colony","PITTSBURGH (KDKA) — A teacher from Oakmont who's been detained in Russia for more than a year is being moved to a hard-labor colony. Marc Fogel, 61, could be at that colony for up to three weeks. Fogel will have no way to communicate with his family while there. His family tells the Tribune-Review the that move is even more worrisome because Russia has been conscripting prisoners to fight the war in Ukraine. This summer, Fogel was sentenced to 14 years in a maximum security prison after he was caught with 17 grams of medical marijuana for a spine condition.",4.513366355115873,5.873116690289529,-1.359750335173656,1
2022-10-05,https://www.cbsnews.com/seattle/news/opec-cuts-oil-production-by-2-million-barrels-per-day/,OPEC and Russia slash oil production in bid to boost prices,"The OPEC+ alliance of oil-exporting countries on Wednesday decided to sharply cut production to support sagging oil prices, a move that could deal the struggling global economy another blow and raise politically sensitive pump prices for U.S. drivers just ahead of key national elections. Energy ministers meeting at the Vienna headquarters of the OPEC oil cartel cut production by 2 million barrels per day starting in November at their first face-to-face meeting since the start of the COVID-19 pandemic. Besides a token trim in oil production last month, the major cut is an abrupt turnaround from months of restoring deep cuts made during the depths of the pandemic and could help alliance member Russia weather a looming European ban on oil imports. In a statement, OPEC+ said the decision was based on the ""uncertainty that surrounds the global economic and oil market outlooks."" The impact of the production cut on oil prices — and thus the price of gasoline made from crude — will be limited somewhat because OPEC+ members are already unable to meet the quotas set by the group. The alliance also said it was renewing its cooperation between members of the OPEC cartel and non-members, the most significant of which is Russia. The deal was to expire at year's end. The decision comes as oil trades well below its summer peaks because of fears that major global economies such as the U.S. or Europe will sink into recession due to high inflation, rising interest rates meant to curb rising consumer prices, and uncertainty over Russia's war against in Ukraine. The fall in oil prices has been a boon to U.S. drivers, who saw lower gasoline prices at the pump before costs recently started ticking up, and for President Biden as his Democratic Party gears up for congressional elections next month. Nationwide, the average price for a gallon of regular gas is $3.83, down a June peak of $5.02, according to AAA, although fuel costs have edged up in recent weeks. ""An average cut of 2 million barrels a day should push gasoline prices higher, but not at a pace that would bring back prices to the $5 a gallon that led to the Biden administration draining supplies from the Strategic Petroleum Reserve,"" Quincy Krosby, chief global strategist for LPL Financial, said in an email. White House press secretary Karine Jean-Pierre told reporters Tuesday that the U.S. would not extend releases from its strategic reserve to increase global supplies. Biden has tried to receive credit for falling gas prices, with administration officials highlighting a late March announcement that a million barrels a day would be released from the strategic reserve for six months. High inflation is a fundamental drag on Biden's approval and has dampened Democrats' chances in the midterm elections. Oil supply could face further cutbacks in coming months when a European ban on most Russian imports takes effect in December. A separate move by the U.S. and other members of the Group of Seven wealthy democracies to impose a price cap on Russian oil could reduce supply if Russia retaliates by refusing to ship to countries and companies that observe the cap. The EU agreed Wednesday on new sanctions that are expected to include a price cap on Russian oil. Russia ""will need to find new buyers for its oil when the EU embargo comes into force in early December and will presumably have to make further price concessions to do so,"" analysts at Commerzbank wrote in a note. ""Higher prices beforehand — boosted by production cuts elsewhere — would therefore doubtless be very welcome."" Dwindling prospects for a diplomatic deal to limit Iran's nuclear program have also lowered prospects for a return of as much as 1.5 million barrels a day in Iranian oil to the market if sanctions are removed. Oil prices surged this summer as markets worried about the loss of Russian supplies from sanctions over the war in Ukraine, but they slipped as fears about recessions in major economies and China's COVID-19 restrictions weighed on demand for crude. International benchmark Brent has sagged as low as $84 in recent days after spending most of the summer months over $100 per barrel. At its last meeting in September, OPEC+ reduced the amount of oil it produces by 100,000 barrels a day in October. That token cut didn't do much to boost lower oil prices, but it put markets on notice that the group was willing to act if prices kept falling.",3.8483688029331633,5.696545876250515,-1.848177073317352,4
