Date,URL,Title,Text,Novelty,Transience,Resonance,Topic
2022-10-16,https://www.cbsnews.com/news/ukraine-russia-bucha-civilians-60-minutes-2022-10-16/,"The stories of the victims found in a mass grave in Bucha, Ukraine - 60 Minutes","This weekend, Russia continued its campaign of airstrikes against Ukrainian cities. But, on the battlefield, Russian troops fell back revealing new horrors of the occupation. We first saw this in April, when Russia abandoned its assault on the capital, Kyiv. In a suburb called Bucha, we found a civilian massacre with a mass grave behind St. Andrew's Orthodox Church. The grave was filled with sand, humanity and mystery. We wondered; who was buried there? What lives had they lived? We promised ourselves, then, that we would return to tell the stories of the lost souls of Bucha. At St. Andrew's Church, in the days before Orthodox Easter, 116 souls rose from the grave. The town of Bucha was excavating the trench to rebury each victim with respect and with their name. Photos of the dead were posted online, DNA was taken. And families grieved to learned the fate of the missing. Inside, St. Andrew's was illuminated by prayer and, last month, we asked some of the families to join us there to introduce us to the ones they loved. ""My father, Viktor, worked as a set designer for TV studios,"" Dmytro Kozyarevich told us. He identified his father and his mother, Nadiya, from photos of the dead. Dmytro Kozyarevich (translation): She was very kind, and I feel her absence very much. Scott Pelley: Viktor was 75. Nadiya was 65. They were in their apartment, minding their own business. And I wonder if you know how they died. Dmytro Kozyarevich (translation): According to what our neighbors told us, there was a tank 120 [yards] away. Perhaps someone inside the tank just had the urge to shoot at something, so they chose this building. My mother died from the blast wave. My father died [crushed by] pieces of the brick wall. Mr. and Mrs. Kozyarevich, married 43 years, were found, days later, in their apartment. Atrocities, like theirs, were what we saw in April—the senseless slaughter of civilians. Bucha, 20 miles from Kyiv, was a modern suburb of 37,000, with big box stores and apartment blocks. But over 27 days in March its people suffered a distinct kind of cruelty—the cruelty inflicted by soldiers facing defeat. 458 were killed--their forsaken bodies calling out to Serhii Kaplychnyi, the Bucha city official in charge of burials. Serhii Kaplychnyi (translation): There were bodies just lying in the streets. We understood that they must be buried, but we didn't know how to go about it. The Russians had left them where they fell--on the street, at their own homes. Serhii Kaplychnyi had to negotiate with the Russians for permission to gather them. We spoke with him and the men who worked with him, Serhii Matiuk and Vladyslav Minchenko. Scott Pelley: I imagine that a mass grave was the last thing that you wanted. Why was it necessary? Serhii Matiuk (translation): There was no more room in the morgue. Serhii Kaplychnyi (translation): We were just placing bodies near the morgue because we had no idea what to do anymore. Scott Pelley: Serhii, where were you finding bodies around town and what kind of condition were they in? Serhii Kaplychnyi (translation): With a lot of the bodies, it was obvious it was the work of a sniper because they were shot in the head. Serhii Matiuk (translation): Some were riding their bicycle, some were bringing firewood in their car, loaded in their car… remember, we picked up that man and woman? They had just loaded firewood into their car and were bringing it back to heat their home. They were shot. Scott Pelley: Was it possible for you to determine how these people had been killed? Vladyslav Minchenko (translation): Most often they shot people in the back. Those who were killed walking down the road – they were shot in the back. The [people] we gathered from the basements – they were all shot in the back. People were on their knees, blindfolded... Serhii Matiuk (translation): The people who were tied up, they were tortured. They were shot… first in a leg or arm, and then the finishing shot was to the head. The Russians were killing too many too fast. There was no electricity for refrigeration. A temporary mass grave was inevitable. Kaplychnyi's only choice in the matter was to dig it in the shadow of god. Vladyslav Minchenko (translation): None of them deserved to die this way. God sees everything. Because of the way they died, their deaths…these people will never be forgotten. Their names, their faces. Let people remember and know that this was done by Russia. For what? For nothing. Most of those killed for nothing were men, but there were also 86 women and 9 children. Some, hands tied, were executed. Elena Rubailo's husband was discovered in the mass grave. Elena Rubailo (translation): He laid in the street for a week and a half until they picked him up and brought him to the [mass grave] He'd been shot in the head. Volodymyr Rubailo was 70. His body was found near a store where he shopped. But like nearly all of the bereaved, Elena has no idea why he was killed. Elena Rubailo (translation): This year would have been our 50th wedding anniversary, but he didn't quite live to see it. We loved each other very much. We had two children, two girls. Volodymyr, retired from a forest management company, stayed in Bucha to watch their home while Elena sheltered in her daughter's basement on the edge of town. Elena Rubailo (translation): There were 21 people, [in the basement], 9 children and 12 adults. We took the neighbors into the basement too. One of our neighbors was shot [March] 4th. He walked out of his gate, and he was killed. And a little further up that same street, a son was driving to his parents' home. He was 10 [yards] away, him and his girlfriend and a friend, and they were all shot in their car. That poor mother, dragging her own son in the door and burying [all of] them in the garden. Just horrible. Scott Pelley: What does Volodymyr's death tell us about this war? Elena Rubailo (translation): This war is terrible. These aren't humans. Could humans really do this? Just come in and kill people... A person just walking down the street… How?? I don't know. This is a terrible war. I pray for our Ukraine every day--for our soldiers. My heart hurts every day when I hear and see this ruin, these rockets flying. So many children have died, so many women, young girls. My heart hurts. My heart really hurts. In Bucha, heartache is part of being. Father Andriy Halavin, the priest of St. Andrew's, told us, ""Since the occupation I've had to bury more than 200 people."" Scott Pelley: And you have buried people who have no name? Father Andriy Halavin (translation): Out of the people whom I buried, 75 had not been identified. Scott Pelley: How do you say a funeral mass for someone who has no name? Father Andriy Halavin (translation): God knows each person's name. He does not distinguish people by whether they are living or dead. For him, everyone is alive. As Christians, we believe in resurrection after death. That's why for God, there is no difference. Of all the bereaved who met us at St. Andrew's, none lost more than Oleksandr Chikmariov. Oleksandr Chikmariov (translation): [They were] my happiness. [They were] my everything. I wish I could bring everything back. Chikmariov and his wife, Rita, tried to flee the shelling of Bucha. In their car, with their sons, 9-year-old Matviy and 4-year-old Klym, they came across a Russian armored vehicle. Oleksandr Chikmariov (translation): We stopped. Rita yelled for me to make a U-turn and drive back. I heard shots. I turned to the back seat, and Rita shouted [""I'm hit!""] Rita and my children were dead. I was in such shock; I didn't notice that my leg was only hanging on by a piece of skin. I didn't even feel the pain. I got down behind the car, and then the car burst into flames. Oleksandr Chikmariov was rescued by firemen and watched his family burn. He wanted us to see his family so he led us, on his artificial leg, across the street from St. Andrew's. Their home happened to be next to the makeshift cemetery where his family was first laid to rest. Remembering lives like these, lost to the Russian invasion, is the reason we returned to Bucha. Scott Pelley: What would you like the world to remember about them? Oleksandr Chikmariov (translation): For the world to remember…well... So much joy. Such a thirst for life. Why did he have to die? For what? It doesn't make any sense. Why? It doesn't make sense, in any world, to kill them. Why? What was he killed for? How can I go on living? Just to keep crying, and keep breathing? What should I do? What else can I do? He's not here anymore, I cannot hug him, I cannot kiss him, I cannot do anything. They were the meaning of my life. How can I live with this? How? Just hold on and endure? To just endure, to fight everything inside of myself? What should I do next? I don't know how to live. Scott Pelley: I am so very sorry. Bucha is learning how to live again. In the fresh earth of the city cemetery, bodies from the mass grave have been laid to rest with dignity. But, about 50 remain unidentified. This marker reads, ""here lies number 282,"" ""remember forever."" The city says it will work forever to replace each number with a name. The bereaved will know what lives were lost but never the reason why. Produced by Maria Gavrilovic and Alex Ortiz. Broadcast associate, Michelle Karim. Edited by Michael Mongulla.",5.75132547915788,5.556344822886073,0.19498065627180683,6
2022-10-15,https://www.cbsnews.com/dfw/news/russia-military-range-shooting-dead-wounded-belgorod-region/,"Russia military range shooting leaves 11 dead, 15 wounded, defense ministry says","Two volunteer soldiers fired at other troops at a Russian military firing range near Ukraine, killing 11 and wounding 15 others, before being killed, the Russian Defense Ministry said on Saturday. The ministry said in a statement that the shooting took place in the Belgorod region in southwestern Russia that borders Ukraine. It said that the two men from an unnamed ex-Soviet nation fired on soldiers during target practice and were killed by return fire. The ministry called the incident a terrorist attack. The shooting comes amid a hasty mobilization ordered by President Vladimir Putin to beef up Russian forces in Ukraine — a move that triggered protests and caused hundreds of thousands to flee Russia. Putin said on Friday that over 220,000 reservists already had been called up as part of an effort to recruit 300,000. Even though the Russian leader declared that only people who had recently served in the military will be subject to the call-up, activists and rights groups reported military conscription offices rounding up people without any army experience — some of whom were also unfit for service for medical reasons. Some of the freshly called-up reservists posted videos of them being forced to sleep on the floor or even outside and given rusty weapons before being sent to the front lines. Authorities have acknowledged that the mobilization was often poorly organized and promised to improve the situation.",1.7870796261311643,1.2229341024536482,0.5641455236775161,3
2022-10-15,https://www.cbsnews.com/news/elon-musk-spacex-funding-starlink-ukraine/,"In reversal, Elon Musk says SpaceX will continue funding Starlink in Ukraine","Elon Musk on Saturday announced that his company would continue to pay for Starlink satellite internet in war-torn Ukraine, a day after suggesting he cannot keep funding the project. ""The hell with it,"" the world's richest man wrote on Twitter. ""Even though Starlink is still losing money & other companies are getting billions of taxpayer $, we'll just keep funding Ukraine govt for free."" Musk had said on Friday that SpaceX would not be able to pay for Starlink in Ukraine indefinitely. And the U.S. military confirmed it was communicating with the billionaire's company about funding for the key network. The discussions come as Musk has been embroiled in public spats with Ukrainian leaders who were angered by his controversial proposals for de-escalating the conflict, which included acknowledging Russian sovereignty over Crimea. Starlink, a constellation of more than 3,000 small satellites in low Earth orbit, has been vital to Ukraine's communications as it fights against Russia's invasion. SpaceX has donated some 25,000 ground terminals to Ukraine, according to an updated figure given by Musk last week.",2.739944260297029,2.296267894755839,0.44367636554119017,8
2022-10-14,https://www.cbsnews.com/sacramento/news/sacramento-structural-engineer-in-ukraine-to-help-assess-and-rebuild-bombed-buildings/,Sacramento structural engineer in Ukraine to help assess and rebuild bombed buildings,"SACRAMENTO — The owner of an engineering firm in Sacramento is in Ukraine to help assess and rebuild bombed buildings. Kit Miyamoto is leading a team of construction experts that have responded to Ukraine at the request of the United Nations. It is estimated that there are more than 150,000 damaged or destroyed structures in Ukraine due to attacks from Russia. Miyamoto's team is working with local contractors and architects to try and save as many buildings as possible. In the past, his team has been sent to help with earthquakes in Haiti, Mexico, and Japan. He says there are differences between those catastrophes and what he has seen in Ukraine. ""Damage is actually fairly localized, and compared to earthquake damage, it is quite simpler,"" Miyamoto said. The urgency to rebuild stems from the winter being right around the corner and people needing a safe place to live.",2.5262738580106707,3.1518023300004105,-0.6255284719897398,8
2022-10-14,https://www.cbsnews.com/colorado/news/elon-musk-ukraine-satellite-network-starlink-russia-war/,"Elon Musk wants U.S. to fund his satellite network in Ukraine, official says","The Defense Department has gotten a request from SpaceX and Tesla founder Elon Musk to take over funding for his satellite network that has provided crucial battlefield communications for Ukrainian military forces during the war with Russia, a U.S. official said. The official, who spoke on condition of anonymity to discuss a sensitive matter not yet made public, said the issue has been discussed in meetings and senior leaders are weighing the matter. There have been no decisions. Musk's Starlink system of more than 2,200 low-orbiting satellites has provided broadband internet to more than 150,000 Ukrainian ground stations. Early Friday, Musk tweeted that it was costing SpaceX $20 million a month to support Ukraine's communications needs. In addition to the terminals, he tweeted that the company has to create, launch, maintain and replenish satellites and ground stations. CNN was the first to report the Musk request. The request from the world's richest man to have the Pentagon take over the hundreds of millions of dollars he says the system is costing comes on the heels of a Twitter war between Musk and Ukrainian President Volodymyr Zelenskyy. And in tweets overnight Musk referred to the friction, suggesting it may affect his decision to end his company's largesse in funding the systems. In a Twitter exchange last week, Musk argued that to reach peace Russia should be allowed to keep the Crimea Peninsula, which it seized in 2014. He also said Ukraine should adopt a neutral status, dropping a bid to join NATO. Musk also started a Twitter poll asking whether ""the will of the people"" should decide if seized regions remain part of Ukraine or become part of Russia. In a sarcastic response, Zelenskyy posted a Twitter poll of his own asking ""which Elon Musk do you like more?"": ""One who supports Ukraine"" or ""One who supports Russia."" Musk replied to Zelenskyy that ""I still very much support Ukraine, but am convinced that massive escalation of the war will cause great harm to Ukraine and possibly the world."" Andrij Melnyk, the outgoing Ukrainian ambassador to Germany, responded to Musk's original tweet with an obscenity. Musk's request that the Pentagon begin to pick up the tab comes as the Space Force and Pentagon have been looking at how commercial vendors will play a role in national security. In March, commander of U.S. Space Command Army Gen. James Dickinson said that having many vendors providing needed capabilities, such as Maxar's satellite imagery of stalled Russian convoys, has become essential, because it frees up limited military satellite assets to focus on other things. In his tweets, Musk also raised a question that various vendors and the Pentagon are considering as space becomes a more critical part of wartime operations: If a commercial vendor is assisting the U.S. and is targeted, does the U.S. owe it protection? ""We've also had to defend against cyberattacks & jamming, which are getting harder,"" Musk tweeted.",1.902564266337619,2.8159921325624606,-0.9134278662248416,8
2022-10-13,https://www.cbsnews.com/news/ukraine-news-russia-missile-iranian-drone-strikes-kyiv-zaporizhzhia-putin/,"With munitions ""running out,"" Russia hurls Iranian drones and anti-aircraft missiles at Ukraine's cities","Russia launched new attacks around Ukraine's capital and other regions overnight, including sending Iranian-made self-detonating drones packed with explosives hurtling into towns around Kyiv. The drone attack set off air raid sirens and sent people running for shelters yet again in the capital, in a fourth day of reprisals by Moscow for a bombing that damaged a bridge providing the only land link between Russia and the occupied Crimean Peninsula. Vladimir Putin's escalating war on Ukraine is now led by a hard-line commander whose reputation for brutality earned him the nickname ""General Armageddon."" For days it has been clear that the strategy is to increase the aerial assault not only on the front lines, where Russia has lost ground in recent weeks, but across Ukraine. It wasn't immediately clear if the self-detonating drones had killed or wounded anyone, but Ukrainian officials said Thursday that 13 people were killed and almost 40 others wounded over the preceding 24 hours of Russian missile strikes all around Ukraine. The southern city of Mykolaiv was struck again early Thursday, with Russian missiles destroying a five-story apartment building. The regional governor, Vitaliy Kim, said an 11-year-old boy was rescued from the debris six hours after the strike, but seven others remained missing. Kim said Russia hit the building with an S-300 missile — a weapon designed, and usually used to bring down enemy aircraft. Russia has seemingly turned to the S-300s more often to carry out indiscriminate attacks on Ukrainian cities, amid intelligence reports that Putin's army is running low on weaponry, and on morale. ""We know, and Russian commanders on the ground know, that their supplies and munitions are running out,"" Sir Jeremy Fleming, head of Britain's cyber intelligence agency GCHQ said in a speech on Tuesday. The city of Zaporizhzhia — in Ukrainian-held territory but not far from the sprawling, Russian-occupied nuclear power plant that has been the focus of rising concern over a possible nuclear accident — was also hit again on Thursday. The city, about 20 miles from the nuclear plant, has been the target of relentless Russian bombardment. Some of the missiles have slammed down in residential areas, and CBS News saw rescuers pulling one victim from beneath the rubble of an apartment building. Over the past two weeks, more than 70 civilians have been killed by Russia's aerial assault in Zaporizhzhia alone, according to Ukrainian officials. Ukraine's military claims it has managed to shoot down dozens of the missiles and Iranian-made ""Shahed-136"" drones Russia has fired over the past week, but with so many still getting through to wreak havoc on the country's infrastructure and beleaguered civilians, it is desperate for more help. To stop the aerial assault, President Volodymyr Zelenskyy begged this week for the U.S. and other partners to send Ukraine more, and more advanced, missile defense systems. He was assured that help is on the way.",1.8426063573537763,1.3254139668400864,0.5171923905136899,9
